{
  "metadata": {
    "name": "DNS Tool Topology",
    "version": "v26.34.40",
    "seed": 1729,
    "units": "px",
    "status": "extracted_from_production",
    "note": "Extracted from live topology.html \u2014 canonical fixture for solver and benchmark."
  },
  "viewportProfiles": {
    "desktop": {
      "id": "desktop",
      "width": 1600,
      "height": 900,
      "rankGap": 150,
      "intraRankGap": 26,
      "stageGapY": 72,
      "margins": {
        "top": 60,
        "right": 40,
        "bottom": 80,
        "left": 420
      },
      "zoneTemplates": {
        "source": {
          "x1": 430,
          "y1": 90,
          "x2": 590,
          "y2": 800,
          "padding": 8
        },
        "hub": {
          "x1": 500,
          "y1": 300,
          "x2": 680,
          "y2": 520,
          "padding": 8
        },
        "engine": {
          "x1": 690,
          "y1": 90,
          "x2": 860,
          "y2": 245,
          "padding": 8
        },
        "confidence": {
          "x1": 650,
          "y1": 250,
          "x2": 930,
          "y2": 560,
          "padding": 8
        },
        "storage": {
          "x1": 640,
          "y1": 540,
          "x2": 960,
          "y2": 820,
          "padding": 8
        },
        "protocol": {
          "x1": 930,
          "y1": 120,
          "x2": 1250,
          "y2": 820,
          "padding": 8
        },
        "output": {
          "x1": 1290,
          "y1": 180,
          "x2": 1540,
          "y2": 760,
          "padding": 8
        }
      }
    },
    "tablet": {
      "id": "tablet",
      "width": 1100,
      "height": 820,
      "rankGap": 110,
      "intraRankGap": 22,
      "stageGapY": 64,
      "margins": {
        "top": 50,
        "right": 30,
        "bottom": 70,
        "left": 220
      },
      "zoneTemplates": {
        "source": {
          "x1": 230,
          "y1": 90,
          "x2": 360,
          "y2": 740,
          "padding": 8
        },
        "hub": {
          "x1": 310,
          "y1": 280,
          "x2": 480,
          "y2": 470,
          "padding": 8
        },
        "engine": {
          "x1": 470,
          "y1": 90,
          "x2": 620,
          "y2": 250,
          "padding": 8
        },
        "confidence": {
          "x1": 440,
          "y1": 250,
          "x2": 670,
          "y2": 500,
          "padding": 8
        },
        "storage": {
          "x1": 430,
          "y1": 500,
          "x2": 680,
          "y2": 740,
          "padding": 8
        },
        "protocol": {
          "x1": 680,
          "y1": 100,
          "x2": 910,
          "y2": 750,
          "padding": 8
        },
        "output": {
          "x1": 940,
          "y1": 180,
          "x2": 1070,
          "y2": 720,
          "padding": 8
        }
      }
    },
    "mobile": {
      "id": "mobile",
      "width": 420,
      "height": 1400,
      "rankGap": 0,
      "intraRankGap": 18,
      "stageGapY": 40,
      "margins": {
        "top": 30,
        "right": 14,
        "bottom": 40,
        "left": 14
      },
      "zoneTemplates": {
        "source": {
          "x1": 14,
          "y1": 60,
          "x2": 406,
          "y2": 220,
          "padding": 8
        },
        "hub": {
          "x1": 14,
          "y1": 240,
          "x2": 406,
          "y2": 320,
          "padding": 8
        },
        "engine": {
          "x1": 14,
          "y1": 340,
          "x2": 406,
          "y2": 420,
          "padding": 8
        },
        "confidence": {
          "x1": 14,
          "y1": 440,
          "x2": 406,
          "y2": 600,
          "padding": 8
        },
        "storage": {
          "x1": 14,
          "y1": 620,
          "x2": 406,
          "y2": 760,
          "padding": 8
        },
        "protocol": {
          "x1": 14,
          "y1": 780,
          "x2": 406,
          "y2": 1150,
          "padding": 8
        },
        "output": {
          "x1": 14,
          "y1": 1170,
          "x2": 406,
          "y2": 1360,
          "padding": 8
        }
      }
    }
  },
  "zones": [
    {
      "id": "source",
      "label": "Source",
      "orderX": 1
    },
    {
      "id": "hub",
      "label": "Hub",
      "orderX": 2
    },
    {
      "id": "engine",
      "label": "Engine",
      "orderX": 3,
      "orderY": 1
    },
    {
      "id": "confidence",
      "label": "Confidence",
      "orderX": 3,
      "orderY": 2
    },
    {
      "id": "storage",
      "label": "Storage",
      "orderX": 3,
      "orderY": 3
    },
    {
      "id": "protocol",
      "label": "Protocol",
      "orderX": 4
    },
    {
      "id": "output",
      "label": "Output",
      "orderX": 5
    }
  ],
  "nodes": [
    {
      "id": "root",
      "label": "Root / TLD",
      "zoneId": "source",
      "shape": "rect",
      "width": 122,
      "height": 30,
      "tags": [
        "source"
      ],
      "data": {
        "sub": "IANA Root Zone \u00b7 TLD Registries"
      }
    },
    {
      "id": "rdap",
      "label": "RDAP / WHOIS",
      "zoneId": "source",
      "shape": "rect",
      "width": 128,
      "height": 30,
      "tags": [
        "source"
      ],
      "data": {
        "sub": "Registration Data Access Protocol"
      }
    },
    {
      "id": "ct",
      "label": "CT / Subdomains",
      "zoneId": "source",
      "shape": "rect",
      "width": 136,
      "height": 30,
      "tags": [
        "source"
      ],
      "data": {
        "sub": "crt.sh \u00b7 Certspotter Transparency Logs"
      }
    },
    {
      "id": "cisa",
      "label": "CISA / Threat",
      "zoneId": "source",
      "shape": "rect",
      "width": 126,
      "height": 30,
      "tags": [
        "source"
      ],
      "data": {
        "sub": "BOD 19-02 IP Scanner Detection"
      }
    },
    {
      "id": "probes",
      "label": "Probe Fleet",
      "zoneId": "source",
      "shape": "rect",
      "width": 116,
      "height": 30,
      "tags": [
        "source"
      ],
      "data": {
        "sub": "SMTP \u00b7 DANE \u00b7 TLS Nmap \u00b7 testssl.sh"
      }
    },
    {
      "id": "hub",
      "label": "DNS Resolvers",
      "zoneId": "hub",
      "shape": "roundRect",
      "width": 136,
      "height": 40,
      "tags": [
        "hub"
      ],
      "data": {
        "sub": "Signal Aggregation"
      }
    },
    {
      "id": "engine",
      "label": "ICIE",
      "zoneId": "engine",
      "shape": "circle",
      "width": 108,
      "height": 108,
      "tags": [
        "engine"
      ],
      "data": {
        "sub": "Analysis Engine"
      }
    },
    {
      "id": "ietf",
      "label": "IETF Metadata",
      "zoneId": "confidence",
      "shape": "rect",
      "width": 136,
      "height": 30,
      "tags": [
        "confidence",
        "intel"
      ],
      "data": {
        "sub": "RFC Status \u00b7 Errata Draft Tracker"
      }
    },
    {
      "id": "icae",
      "label": "ICAE",
      "zoneId": "confidence",
      "shape": "diamond",
      "width": 84,
      "height": 84,
      "tags": [
        "confidence"
      ],
      "data": {
        "sub": "Accuracy Audit"
      }
    },
    {
      "id": "icuae",
      "label": "ICuAE",
      "zoneId": "confidence",
      "shape": "diamond",
      "width": 84,
      "height": 84,
      "tags": [
        "confidence"
      ],
      "data": {
        "sub": "Currency Audit"
      }
    },
    {
      "id": "ede",
      "label": "EDE",
      "zoneId": "confidence",
      "shape": "diamond",
      "width": 96,
      "height": 96,
      "tags": [
        "confidence"
      ],
      "data": {
        "sub": "Epistemic Disclosure"
      }
    },
    {
      "id": "postgres",
      "label": "PostgreSQL",
      "zoneId": "storage",
      "shape": "cylinder",
      "width": 132,
      "height": 44,
      "tags": [
        "storage"
      ],
      "data": {
        "sub": "Scan Results \u00b7 History Drift \u00b7 Analytics"
      }
    },
    {
      "id": "fixtures",
      "label": "Golden Fixtures",
      "zoneId": "storage",
      "shape": "cylinder",
      "width": 152,
      "height": 44,
      "tags": [
        "storage"
      ],
      "data": {
        "sub": "Known-Good Baselines RFC Compliance Seeds"
      }
    },
    {
      "id": "wayback",
      "label": "Internet Archive",
      "zoneId": "storage",
      "shape": "cylinder",
      "width": 148,
      "height": 44,
      "tags": [
        "storage"
      ],
      "data": {
        "sub": "Wayback Machine Permanent Record"
      }
    },
    {
      "id": "spf",
      "label": "SPF",
      "zoneId": "protocol",
      "shape": "circle",
      "width": 72,
      "height": 72,
      "tags": [
        "protocol",
        "email"
      ],
      "data": {
        "rfc": "7208"
      }
    },
    {
      "id": "dkim",
      "label": "DKIM",
      "zoneId": "protocol",
      "shape": "circle",
      "width": 72,
      "height": 72,
      "tags": [
        "protocol",
        "email"
      ],
      "data": {
        "rfc": "6376"
      }
    },
    {
      "id": "dmarc",
      "label": "DMARC",
      "zoneId": "protocol",
      "shape": "circle",
      "width": 72,
      "height": 72,
      "tags": [
        "protocol",
        "email"
      ],
      "data": {
        "rfc": "7489"
      }
    },
    {
      "id": "dnssec",
      "label": "DNSSEC",
      "zoneId": "protocol",
      "shape": "circle",
      "width": 72,
      "height": 72,
      "tags": [
        "protocol",
        "policy"
      ],
      "data": {
        "rfc": "4035"
      }
    },
    {
      "id": "dane",
      "label": "DANE",
      "zoneId": "protocol",
      "shape": "circle",
      "width": 72,
      "height": 72,
      "tags": [
        "protocol",
        "transport"
      ],
      "data": {
        "rfc": "6698"
      }
    },
    {
      "id": "mtasts",
      "label": "MTA-STS",
      "zoneId": "protocol",
      "shape": "circle",
      "width": 72,
      "height": 72,
      "tags": [